{
  "schema_version": 1,
  "id": "selector-cardinality-stop",
  "kind": "counterexample",
  "status": "experimental",
  "scope": {
    "applies_when": [
      "A declared planar +Z maximum-output-Z selector observation reports candidate cardinality other than one.",
      "The dependent action requires one uniquely bound target under the reviewed selector-ambiguity policy."
    ]
  },
  "claim": "Selector cardinality other than one is a terminal ambiguity boundary for the reviewed dependent cut; it is not evidence for generic face recovery.",
  "evidence": {
    "level": "supported",
    "supporting_cases": ["param_face_selected_cut_centered_nominal", "param_selector_ambiguity_twin_centered_nominal"],
    "counterexamples": ["twin-boss multi-candidate result: do not choose a face or run the dependent cut"]
  },
  "runtime_action": "If and only if the declared selector observation reports cardinality other than one, do not bind a target, do not attempt the dependent action, and stop with the existing selector_ambiguous policy. This experimental card is not mounted, injected, or retrieved by default.",
  "validation": {
    "review_trigger": "Re-review before any selector scope, cardinality predicate, repair route, retrieval experiment, or runtime promotion changes."
  },
  "sources": [
    "docs/corpus/knowledge/admissions/selector-ambiguity-v1.json",
    "docs/architecture/v1/m29-selector-ambiguity-controlled-production-review.md",
    "docs/architecture/v1/contracts/classified-repair-policy.md"
  ]
}
